{
  "$schema": "../../ci/driver-package.schema.json",
  "additionalFiles": [
    "packaging/win7/README.md",
    "tools/win7_dbgctl/README.md",
    "legacy/README.md",
    "legacy/aerogpu.inf",
    "packaging/win7/install.cmd",
    "packaging/win7/uninstall.cmd",
    "packaging/win7/sign_test.cmd",
    "packaging/win7/trust_test_cert.cmd",
    "packaging/win7/verify_umd_registration.cmd"
  ],
  "requiredBuildOutputFiles": ["tools/win7_dbgctl/bin/aerogpu_dbgctl.exe"],
  "toolFiles": ["tools/win7_dbgctl/bin/aerogpu_dbgctl.exe"],
  "infFiles": ["packaging/win7/aerogpu_dx11.inf"],
  "wow64Files": ["aerogpu_d3d9.dll", "aerogpu_d3d10.dll"]
}
